review_id,user_id,business_id,stars,text
INSGnYhsLHPc7v0VjuNxzw,oQLVpszk6Bz5zEwZSrEY-g,0ol0GxG-mp_ZZlrSlXFeWA,1.0,"im going to have to give this place one star for its horrible customer service:  i called in to ask about the 50% off for tulane students they were advertising, the woman assured me if i came with an id it would be half off and made an appointment for me, only once i got there did they tell me it's only on certain days, ""it says it right on the sign,"" i was perturbed by the inconvenience and said so you're not going to honor it even though you just made an appointment with me and told me it would be 50% off, they said no flat out at first even though the error was blatantly on their side, after my nagging, she eventually called john jay himself and he told the woman that he would not honor what i was told even though i had been inconvenienced by someone in HIS staff because it might cause a 'domino effect,' i said how will there be a domino effect unless you continue to give people incorrect information, there will be no other 'dominoes' as long as you remember what day it is from now on... they began to treat me somewhat patronizingly as i explained that usually businesses make concessions when they are the one at fault, that the customer is supposed to always be right, yadda yadda yadda, i left pretty upset and with ~45 minutes of my life having been wasted - empty handed but for a lame excuse from someone who owns at least 3 businesses over 10 dollars...  i have not received a haircut from them so if you're one of those people who ONLY cares about the product and you think you'll get a good cut go right on ahead, but if you're like me (principled) and you don't like handing profits to people who care nothing about their customers this is a good place to skip next time you need a cut"
-RsFYcZz0HeSrAhu5xDWBg,-cb2SLDoCysQFxbDDf_0pg,Q1HHAb4FzrzfnnrRyA8fgg,2.0,"My sister-in-law and I visited this restaurant on 8/28/15 mid afternoon.  We were seated after requested 3 times that the hostess speak a little louder because we couldn't even hear her with the background music.  We were seated in a booth with a never ending Larry King vitamin commercial on the TV - really?  Our waitress introduced herself and a new trainee and then we never saw her again.  Two other wait staff seemed to be sharing our table, but no idea who was responsible for our table.  We got our drinks and ordered, but food took forever considering there was not more than 15-20 filled tables in the entire restaurant.  Burgers were not bad - I ordered the blue cheese burger and it would have been better with less blue cheese, way too much!  Fries and onion sticks were very good.  But no one came to see if we were satisfied, needing anything, etc and took two requests and waiting to get a carry out box.  There was a family seated across the aisle from us when we arrived and we assumed they had finished their meal and were ""hanging out"".  Only after we received our food did we understand they had already ordered and still did not have their food!  I doubt I will return to this restaurant in the future."
2zN9R1C5RTZ9oxuQ1uhP6Q,hDvvt85_jRElidmq5nvJ4Q,8zvsq2duG2u0rB7R8ZDeMg,1.0,"They have the WORST service advisors! Used to be good before Kelly and her team left. Unfortunately, it's convenient to work if I need oil change before I can make it to another Honda dealer."
qeSxL-POvGLZD6aQ5O9kvw,4JrKQ9JqjYLk15dKQF9Gkg,yE1raqkLX7OZsjmX3qKIKg,1.0,"--------DINNER REVIEW----------  I rarely write reviews, but this honestly was one of the worst group dining experiences I've ever had. It was objectively a horrible experience, even without comparing it to the hype it receives, and ruined what was supposed to be a nice birthday dinner celebration.   We had a group of 8 that had a reservation made well in advance. Short wait, but not too bad. Keep in mind, it seemed like a normal Friday night, but weren't super busy or at-capacity.  It was a birthday dinner, so I told the hostesses that it was her birthday, and asked if they could bring out something for her at the end of the meal, which was acknowledged. Pretty standard stuff, whether at a Applebee's or the French Laundry. We were sat at a booth right next to the Maitre D' stand, and next to all the wait staff's home base, so pretty much no excuse for not getting any attention.   After getting us waters, it took them a LONG time to even come by and acknowledge us. After ordering wine, it took them another good 15-20 minutes to even bring us our wine, and no one even checked in on us! (hint: if you're running a restaurant, wine is your profit center and doesn't take any work other than taking a bottle off a shelf and opening it. bring it out ASAP...).   After ordering food, it was more of the same...a long wait for food to start coming out and no one checking in on us AT ALL. We drank the bottles we ordered and had to get up and flag someone down to get another wine order. A couple of us even got up during the meal to remind them to bring out something for birthday girl at the end of the meal.   Once our meal was done and taken away, we were given dessert menus and the server disappeared for 10-15 minutes... AGAIN. After coming back, he asked what dessert we wanted, so we ordered some coffees... and waited... and waited. Eventually we got up and asked him what was going on and if they were going to bring anything out like we asked multiple times.   They finally brought out a couple of cookies with a candle...  In summary, the food was pretty hit or miss, pretty mediocre for this price point. Whipped feta, like other reviews have said, was amazing, and the Braised Lamb was really good. But the Sirloin was chewy and bland and the Grilled Caesar tasted like a soggy, luke-warm, wilted mess (two orders were left untouched by a group of 8). Atmosphere was nice and trendy. But the service, which is a huge reason to spend your hard-earned $ at a restaurant, was absolutely horrendous.   I really love going to cool, popular restaurants and having a great time, and I hate writing such a negative review, but I had to share my experience, especially for a restaurant that is getting an awful lot of (undeserved) hype."
6d9hz8LsjvkXjViPW4xaRA,t77iaBQb3pyj2rtwffiLEg,ZnAr0AxYpEYK1ZHNc4fk7g,2.0,"We stopped at Tako due to the positive reviews on yelp. We brought a bottle of white wine with us, the staff did not bring a ice or a chill bucket for us. It took 45 minutes for our appetizers to come out. The edamame was over cooked and mushy while the spring roll did not look appetizing almost like it was frozen. I could buy better spring rolls from trader joes. Next we moved on to our sushi which was sat on the sushi bar for 15 minutes before it was brought to us. The sushi it self was good, but not the best I have ever had, If I came here again I would not buy any appetizers. The service was slow"
OMUO1w4zd02SWAtdPOOmDw,V5N8EVTjBlCiUzD72Rov2Q,V378VWx4D8BstWNRFwDULg,1.0,Whole family got sick after eating here. The frozen yogurt was pretty but did not taste good. Would not go here again or recommend it.
_Dkml_CfMMb_wWeGpFtczg,TRFTDMJegE6DituEKBpEKQ,W6S482dRQ_9nCcLjfv8VNg,1.0,Food was great. But very disappointed with the hospitality. We  entered the restaurant at 9:15 pm but was denied dine in and was told that though the  restaurant closes at 10 pm they won't let us dine in and can give only to go. They saw that there were two pregnant women and a kid with us and I explained that our home is a hour drive from there and yet they denied for no reason. I had to drive back to home and make everyone eat. Very disappointed with such attitude towards customers. Never going back here. Let them try to forgive them self for denying dining for pregnant women.
82lJQteTxdxQVXfm-RU_tw,av5_rihz1f5DLEIt5NrtNA,9gObo5ltOMo6UgsaXaHPWA,2.0,"Walked into the restaurant, with reservations, and many open tables.  I asked the manager for a window table and was responded with ""they are all reserved.""  Two hours later, when we left, still many open tables next to the windows.  Overall food was good. I had the filet and she had the salmon. The bottle of wine that was recommended was $75 and was not told prior to ordering it, just that it was the last bottle."
amIMShQBXjITXiYG6gyiaA,Q1WRnsP8net9hJ-IkU9-4A,SuQgcpL-aZeuyRjBdA0pHw,1.0,"What a disappointment. This place was not good I would suggest you think twice before selecting this option. The manager and wait staff may possibly be the worst I have ever encountered, rude and definitely not focused on customer service.  The manager is a very angry hostile fella I asked if I could get brown rice instead of white and he blasted me...I offered to pay extra and he stormed off? Do not know what the deal was but this is just plain unprofessional and creepy behavior. The waitresses will smack into you while you are eating...man what a mess this place is from top to bottom. The food just OK at best! I am seriously complimenting them here... you can do better at home than here. Seriously I am not going to go into you have been warned just yuk...OK? these other folks with the positive reviews for this place must burn off their taste buds with adult beverages. (Didn't try the sake it may be the high point of the joint...but why would I want to expose my taste buds to a substandard meal to enjoy some rice wine? I can do this at home.  Here is something I am not sure of, I have only lived here a few months now, is it customary to charge for each soda every time you get a refill here? I was charged for each I asked why they said ""This is how we do it here."" So at $2 bucks per 6-8 ounces of beverage you may want to go with water at this place...but smarter yet! Go elsewhere. I will not be returning to this establishment.  Worst yet."
5GNDjFV7Vi7Uganf6OlAbg,7OUAzKZj6LUrQ3G7g7yUSw,S3Kl763P-wKnDLFy0iirqA,2.0,"Let's be honest, this place needs a face lift. It's starting to feel shady, I wouldn't even feel comfortable taking my small children here (if I had any, which I don't). The service is mediocre and everything looks tired. The comedy club doesn't feel cheerful or fun, it just feels like the back hallway of a banquet room.  Great parking and good location though. Please owners, please put some money into this place. It really needs it."
OiiUQHpUPSIw592zKebnTg,Wshkpj8aHWuzIeca1QxWTA,R-HCwu9UbasUudG1yTM1Ow,1.0,"I am positively LIVID.  I went to check my account balance and what do I see? An overdraft fee of $220. How could this happen? My card was never declined and there are two large fees deducted from my account.  I called TD and sat on hold for 45 MINUTES. I don't have that kind of time. Granted, the guy that was with me was nice and helpful, but never mentioned anything about the wait time until I brought it up. I asked about these fees and he said ""Just so you are aware, TD Bank's new policy is that when you have insufficient funds, your card will not be declined. It will be run through, and you will be charged an overdraft fee."" OH THANK YOU FOR TELLING ME NOW, JERK.  I have too many salty words that are unacceptable in the public domain, so I'll stop now.  Needless to say, I am switching banks.  Sort of UPDATE: I thought you Yelpers would like to know that last night, when I was depositing the cash that I didn't have into my account via ATM, I flipped off the cameras. TAKE THAT, TD."
pgESDcC7eDx4z_epqon4_Q,KhAqHRXgVhSClw_Y2ayEqg,plobBsTtVUODb353xxFT_g,1.0,"Came for all-you-can-eat, and ended up waiting for over half an hour to get our order in. The servers completely ignored us, while taking orders from the tables around us. And on top of that, all of the rolls contain ""extras"" not listed on the menu. One roll surprised us by having sweet mustard sauce on it, which did NOT taste very good.... On the bright side, once we actually got our orders in they didn't take all that long to make them."
2gVhwj83q3wKF2-Jvcv6cw,Lj4gnAE2MgjJEQf0b5QSNw,u-eaBrfpqjXTS2TD_cTioA,1.0,"Completely unprofessional and pathetic. I called last week to get price quotes on a battery and brakes. I spoke to someone very nice- he gave me two quotes, fairly low but close to other shops. I call today to schedule a time to come in and the prick who answers the phone, his name is either Mike or Nick (and quite frankly I don't care what he's called), tells me there is no battery even close to that price. He ""blames"" the quote on me, saying ""I don't know how you came up with that price?"" Then I told him I'd like to speak to someone else and he says ""no, we won't do a battery for that price, so bye-bye"" and he HUNG up the phone. NEVER NEVER call these people. I can go to Walmart before I deal with these assholes."
IgfUV2Ggcl36kS7mv8wsaw,v-B443ErZ1P12acLQMgHEA,MkJ5kdhX3Jl48ykeMEVVIw,1.0,"I would NOT recommend this place to anyone. Their biggest mistake is not having a customer service department. They rely on their sales team to provide customer service meaning every time you call in to try and get something done, you get put into a voicemail because the sales guy is out selling - which should be their only job. This left me on numerous occassions incredibly frustrated that I could not get an answer. I even left the manager a voicemail (big surprise I couldn't get them to answer) and they never had the decency to call me back - Just made my sales person call me back.  I purchased my car last July and was promised numerous things would be done to the car before I purchased it. One of which being the tint on the rear window would be removed as the view out of the back was blurry. Somehow, that passed thru inspection and when I came to sign the papers, I noticed that it was still on the back windshield. I was told that they would have it removed by the time we were done the paperwork. Also, I was told that the price was going to be higher than the original agreement because the sales manager did the math wrong the previous day when we ran numbers. I told him that wasn't my fault and I would only pay the agreed upon amount and he spoke with the manager and got it sorted out.   After sitting in the office for 2.5 hours, they finally told me that they were unable to even start taking off the tint and I would have to bring the car back. I dropped it off that Friday and let them keep it for the weekend. My sales guy called me on Saturday night to tell me that they never got to finish it and I would have to bring it back again and leave it. I live 45 minutes from the dealership so this isn't something I can easily do. I insisted on them giving me a loaner car for whatever day they would do this as I was sure this wouldn't be a one day process from my previous experience. 2.5 weeks later they were able to provide me with said car and I dropped off my vehicle. When I went to pick up my ""finished car"" there was still tint left on the bottom of the windshield.   After all of that I knew I would never bring my car back for service there if that's the kind of service they provide. Now with all the rain we've been having, my trunk is leaking and when I called to check with the service department to see if it would be covered under warranty, I got the same run around with the service department who just said ""I don't know"" - OK well give me someone who will be able to tell me. Once they forwarded me to the correct person, I again got ""I don't know"". We need you to bring it in and look at it then submit to our warranty company to see if it gets accepted. No thanks after my previous experience of bringing my car in there to get ""serviced"".   Invest in a customer service department to handle complaints in a professional and timely matter. This should not in any way be left upon the sales department to do. My sales guy did the best he could and I appreciated the help he gave me, but no one else would help me throughout the entire process. Not a good look on managements part."
J96EFyLE15P-VH5kCyxGWA,ifbY7DlrQep2hxR8WBGQbw,gwNlSSV0hGgNgTqPprj4FQ,2.0,"After going there several times going to Fresh I am sad to report my last visit was not up to par.  I went with a group of people and the service / product was not how it used to be and the price was outrageous to say the least.  I entered and was not greet by the staff  and I do understand that the group I was meeting with was taking up most the inside of Fresh, but a little acknowledgement would have went a long way.  Also, I ordered the Vienna Latte with an extra shot.  It not only was one of the worst espresso based drinks I have ever had, but it was EXPENSIVE $7+ for a coffee?!?!  After realizing the price for the drink I was put off by ordering any products.  I really love Fresh and obviously from prior posts I do praise their products, but this time it was one of the worst experiences I have had."
hgah1g29AmdWrp3QPhEbPA,Q9t5Z5_ZGn-5KUNjElNZWw,Ym8E4Lgi3IfH53YuG5WxIg,1.0,"I'm not sure what changed over the last year at this restaurant, but now it's just terrible food. Before, when I first started coming, it was decent: nothing fancy, but filling and palatable. Now, though, the food is disgusting. 90% of their buffet offerings are WAY too salty. The pulled turkey was tough, the fish tasted like licking a bottle of meat tenderizer, and the vegetables cooked to a putty-like state. The only thing vaguely edible was the corn pudding and mashed potatoes. The desserts are ok, almost store-bought quality.   The service at least was good. Our waitress refilled our drinks promptly and removed plates often. The only good I saw all night."
GXlrpVd8rnL8gMgxczbd1g,q-EBNzv_YO5CE0Q_Ln7D5Q,vOgQnvKbE4nMopFTjoL8Gg,2.0,"Pretty bummed I didn't try out the Catbird Seat, because this place was totes underwhelming. When you enter, there is a large, awkward entrance and you have to go upstairs to be seated. It was probably only half full, but since it was strange weather, we decided to sit indoors. I'll just say again, walking up towards the hostess as she watches you approach just feels....weird.   Our server was nice, and we joked with him about the silly flower in a very knock-over-able vase. We got two drinks--julep and one of their other ones with gin, both of which were utterly average to bad.   The crowd was sort of stuffy. The bread was blah. The food was pretty forgettable. The tenderloin was good because it was a good cut of meat. The Amish chicken was pretty average, with a not so flavorful and slightly MSG-y twang jus. Their signature grits was underwhelming as well.   All in all, stuffy and so overpriced. Bummed out!"
xz7n9r3Y1856-T3Xrbhs3w,yLt1pqbQsRXMguOIId_aGA,SVV1VmybJGXGge6nFuHy_A,1.0,"It is unfortunate that with such a unique location and such a brand and product offering this specific store offers such lousy service. The wait is endless, no one is available to help and at Christmas time getting a gift wrap is act of God that requires endless wait. I bought gifts and knew that the wait for wrapping would be long SO I even left my items at the store to be gift wrapped at their leisure. They were not even moved from the counter where I bought them when I returned almost two hours later ready for pick up. This was a gift that needed to be given and The staff COMPLETELY ""dropped the ball"" on my time constraints!   I love their stuff, but today was my last shopping experience at this location: couldn't get a gift wrapped after being assured that it could be done in a timely fashion???  I'll  cancel my card, do everything online and try not to go there if I can. It's really a shame!"
yFV9UnuTR3wqCVRwkeYGxA,tgZ0r69ap3_-sNBgLPZsPw,C_EtrXTygRX5RTUOKtO6Dg,1.0,"It's a good thing I've had a few weeks to cool off from my experience at Copabanana before writing this review or it might not have been pretty. Anyhow, I came during university city restaurant week and will never return. We sat outside and there were kids playing football right near the tables and being loud. We moved to the other side of the restaurant (still outside) and the kids made there way over to us and continued playing. We couldnt get away. We went to a table inside. Food was terrible. Steak was fatty and overcooked and mashed potatoes werent fresh. The waitress was about the only thing good about this place. She agreed on the steak and took it back. Came back with chicken as I asked for and it was like biting into rubber bands. All in all it was a disaster and I'll never return. 1 star for the waitress."
MtZJKwddFSyBB0QHXQRtZQ,_cdp1FAjIT2paX8s8H3GUw,ZdHf2EkMQPV2OBNgGhMAKQ,2.0,Paid for non-smoking room but there was a smell and ashtrays in the room. Since all we were doing was sleeping there we didn't say anything. Shower was crazy slow to drain. Pillows were so lumpy that I woke up with a migraine. Room was clean and staff was nice. Free wifi but wouldn't connect.
zyWcynpTTkXaM3bfyALlBg,fPmWOEvI5SipdVav3fcIqA,NT5S6JV5wPwKOd3s3Yh1zQ,2.0,"Ew. I don't know what upsets me more, the borderline gross food or how much I had to pay for it. We waited forever to get into this place which served me a relatively tasteless burger on an incredibly soggy McDonald's quality bun and the saltiest fries I have ever eaten. Yes, truffle oil is delicious, but pouring it over burned, greasy fries does not a delicious, 16 dollar meal make. We won't be back."
p8y5nanIxGGzAAqiCuxBdA,CysTz612pTix75Fye6-D4Q,EqEcDeXqIq1YwnzHg_ZUFw,1.0,"Similar experience at this place ..gelato is great...service sucks.a friend from out of town came to visit and we decided it would be cool to go here since they never had gelato..boy what a mistake..day staff cool..night staff not so much..they acted like we were an annoyance then a customer then whispering and laughing ..made my friend feels uncomfortable..so the young manager pops out from the back and I'm thinking cool though s guy will make them act more respectable,again wrong..he actually joined in.this place had great service not even a year ago..don't know what happened"
jF3ZlgxpM88UjKymEfSJmQ,CtRP-ARklDGTJ8aVji47Ug,ompDR5sUDpoI6gnTldmneQ,2.0,"This was my very 1st time in New Orleans. It's been an amazing experience and so far, every single place I've eaten at has been AMAZING. So... I took a chance with The Praline Connection and walked in. Why? The ambiance and the restaurant, overall, looked nice.  However... I would NEVER return to this place again, nor would I Ever RECOMMEND it to Anyone.   APPETIZERS: I ordered the BBQ Oysters and..wow.. fucking wow...1st of all the oysters not in their shells. Instead they placed in a soup cup filled with  ""BBQ sauce"" that tasted like cheap Ketchup and Chef Boyarde! Disgusting! The oysters themselves were gooey.  The garlic bread was God awful! It tasted like stale frozen garlic bread. To make matters worse, when I received these appetizers, they were cold.. It tasted and looked like they had been microwaved and left out.    I also ordered the Chicken wings. They were under cooked, cold and the sauce was nasty.    The other members of our party ordered entrees. They all said, ""This Sucks!""  PROS: The service was great. The servers were all very polite and attentive.  Restaurant was clean, nice tables, nice ambiance."
12WmsX0EwwDlQyGXAgtkww,xUhG4eI0M1KRvucUn0t19w,QSA-x2bb3kum9QLFpy7vUg,2.0,"This is the McDonalds closest to my home, but I will forever drive any distance to find another bc it's a terrible restaurant. Even though it's not politically correct to say ""I love McDonalds"", every now and again and during lent we go to McDonalds and this one is really bad. Bad food, always cold or wrong items.  Bad service, and no offense to anyone but I cannot even communicate with most employees bc they don't speak any ENGLISH!!  I do not know much Spanish either but when I'm trying to spend my money in Fishers Indiana at a business I at least expect to be able to communicate in some way!  Their service is the slowest from any McDonalds in this area!  My advice: pass on this location unless you have allot of time and can speak Spanish !!!!"
yqQmwEhvkAySMyGrRsRjQw,XTWdXSOoUJnIMiVSA-1gDg,_RwlMTw9uFeOkfX9Ctf1HA,1.0,"Ick.  That sums up my experience at Dinardo's in one ""word.""  Dinardo's gave me that ""Ick"" vibe the minute I set my foot in the door. THough we were greeted by a very friendly hostess, the place looked like a run down diner on the interior--and it wasn't very clean or charming.  This would have been fine because a lot of times the ""run down"" places have the best ""authentic food,"" but this was not the case at Dinardo's.  At Dinardo's you do not get what you pay for as the prices are rather high and the food quality is rather low.    Our server hated his life and made snarky, mean comments throughout our time there which, though entertaining, was kind of unwelcome and unpleasant.  My friend had the mussels which were puny and in an unimpressive sauce--unimpressive being the general adjective I would use to describe any given dish my party ordered.  I had a soup which was extremely salty and bland beyond that and the broiled flounder and ""seafood imperial"" dishes were OK at best.   I'd say if you're looking for good seafood you'd be better off at any BYOB; little fish, audrey claire, ANYWHERE but Dinardo's.  I don't understand how this place is still in business, to be honest."
