review_id,user_id,business_id,stars,text
1z8mbdO4WAA1xplhixA5VQ,kMGGxl5wIq36Etd3XBkkCw,SlGNxQI23jc9iTZNTs_I3g,1.0,"Every time we go to this place, we go because of the enticing beer selections, but time after time we leave disappointed by a complacent bar staff that makes you feel like an inconvenience. It's such a shame. The beer selection is second to none, but this time we had one drink and decided to spend our money elsewhere for dinner. This place has been consistent for sure, every time we go, we get a miserable bartender who seems like they'd rather be working on a slow night when they don't have to talk to people. All of the enticing beer in the world won't bring us back.   The owners brother has a great place a few miles away, Brickside Grill, we went there instead...good beer, excellent food and the staff is consistently friendly and engaging!"
w5aB9esyhoCh0cNnltqv_w,0yBBVHdbfBC14E3c3FdeJg,arpAjDjebOzjwwysIGIwAg,1.0,"I have been going to this nail salon for years off and on. I came here back when it was called Tropical Nails and Tom was the owner. Now its Grant Nails and has a different owner. When I started getting my nails done again I lucked out and found an experienced technician named Amy. I stuck with her because she did good nails. Then about 2 months ago Amy left. So I let the owner Angela do my nails. The first time was ok. Then the second time she did them the gel polish (which she talked me into getting instead of regular polish) started to chip within a day. I called and complained, she redid the polish and again within one or two days it was chipping. Now my nails look at mess. I don't trust her to correct the problem. Unfortunately, I'm going to have to find a new nail place. Very upsetting and disappointing."
Bz1DS2J28EzTLJHsaTyM7g,EROW4chFZQF1E-eZVpYAAA,diwwt5QBU3-Thig9SVlsOA,2.0,"The only good part....   Their stage is really cool! Raised up, lights that move around, good sound system, a fog machine, and a pretty big dance floor.    But their food service.... crappy both times Ive been there.   The last time I was there I walked in, hadn't been greeted by anyone at the empty front podium, and just found a table. I figured once I sat down Id wait for an employee to get back to the menus and go up and ask for one. So I saw a lady working up at the front and went up and asked her.  She said that they stopped serving food at...... I cant remember if it was 9 or 10 pm.... but she gave me a certain time that the kitchen closed. I went back to my table and looked at the time. It was 10 minutes before the time she told me the kitchen closed. I thought that was kinda dumb, but oh well.... maybe they stopped taking orders 10 minutes ahead or something. The next thing I see the SAME EXACT LADY seat four people RIGHT NEXT to our table and give them menus. Then she takes their order, and brings out their food. All I wanted were some freakin french fries and I had to sit there and watch the people who got there long after me eating french fries instead. RUDE!"
O9--fIsyIjBhSB8OIwW_QQ,KMwv6qK14VZvC-We6l9LCg,wxNrsZt7towVK4LgjjEo1g,2.0,not impressed!..... the service was great but the pizza i ordered was not good. i love Stella and Trenos pizza so i wast expecting the same type. no desire to return again
-nQRvxUGWYUBqTZdcyvprQ,kCZCIJwvyDqt08mJSF0K7g,I2Yt74AzSQFfyQqgN7PSEg,2.0,"Stayed for one week post Christmas. Unless you take adjoining rooms as a family, strangers conversations/coughs/clearing throats/fights/dogs barking etc feel as if they are in your bed with you. Only slept two out of seven nights after hotel cleared out after New Years. Connecting doors are very poorly insulated. Staff at hotel is superior...really excellent but Starwood needs to do something about insulating those doors. Have stayed many places with connecting doors and never experienced anything as bad. Poor materials used????"
oto8Mqazg6SV63g2hJx7LQ,zDWhnidBcEok7Vqnu-AnMg,oBhJuukGRqPVvYBfTkhuZA,2.0,"was here twice -- first for a nightcap at the bar -- the drinks really were some good stuff and i tried a the lemon hummus and pita -- that was the best hummus ive ever had!  the next morning we came in for brunch, which was pretty much terrible. first of all, it took us 45 minutes to get our food for brunch....and it came out cold and we found a hair. the manager did comp our check though. overall, the bar is great, but i would skip breakfast. what a disappointment for a kimpton restaurant."
8KsAOhkgxmRVL_xqcOh0oQ,5LBa1w6O84T4wk4JU1l5Hw,VeqkfRUzZAKlQer3npXPdQ,1.0,"So my favourite Indian in St Louis is still Spice and Grill on Olive, Husband said lets have a change so we tried out Indias Kitchen this evening and ordered a portion of the goat curry.  Sorry to say this curry was not great, the sauce was very heavy on the salt and tomato and the goat was tough as an old boot, the naan bread was below mediocre. Only nice thing was the rice.  Very Very dissapointed"
XHFOnP_cEiqRRc8_i1rJtQ,gqgX3uu-9-3MJzLdOH8ZtA,cB_9eHHfo9me96cZup-lZQ,1.0,"I have never stayed at a hotel so ghetto. Sure the atmosphere is great and very classy looking. However the staff is the opposite. First of all, my friend booked us a suite for the bachelorette party she was planning. They gave us two separate rooms and my friend had to beg for them to be at least next door to each other since they ran out of suites. Then to make up for it, they threw in free valet. The next day her car had been keyed on her door when the valet brought it from the parking garage. Seriously? Worst experience and I certainly won't ever be back."
0-8YJMqAill6hdhjlQfkbA,5W6Vqa03AyAurgiaDwTVfA,2l8WHcEiwFW0wEvopwa8_A,2.0,"A quasi political rant and a store review all wrapped in one, so enjoy.   Ever since Target hit the scene I really have to ask, ""Who even goes to Kmart anymore?"" I asked this to myself out loud the other day as I had to get my meds filled due to a sinus infection. No one looked at me odd, as there seemed to be several people talking to themselves. I now go here because of the stolid contractual war between Express Scripts and Walgreens. Thanks you two....idiots.....qausi-political rant over.  This store is harshly bright, rather dingy, and the selections, especially in the electronic section, are on the cheaper end.  On top of that, I've found the mainstream DVD and Blu-Ray movies are overpriced.  I laughed at the men's area, especially the young man's department, as they had a tv with music videos playing. I laughed because it just seemed a lame attempt to be cool and creating a shopping experience that you will find at a department store like Macy's or Dillard's. This is hard to create when everything is whitewashed. You will feel like you are in that August Burns Red's ""Whitewashed.""  The best WTF moment is discovering the opportunity to purchase Joe Boxer male thongs. Who knew that Kmart cared about male panty line?  One great tip is you can find patio furniture cheap during the off season and clearance days. I bought a great patio table for under $50. So, keep that in mind.  The extra star is for the pharmacy, as they filled my prescription out efficiently and with the greatest of ease. The hours are little later than Target.  No problems there and credit when credit is due!  The later 80s quote, ""K-Mart sucks"", remains as true as ever and who knows, you may even bump into someone who still dresses from that Tom Cruise era who cares about male panty line. One never knows?"
0gFENhAB6mfMwL1V0Z2fWw,6O_FYCuqBqsTcWGGTvvjSQ,WQ832PDnsDshhbQFm83ISg,1.0,"Went to see Star Wars Rogue One yesterday in 3D.  Buying the tickets was a breeze, and the atmosphere was inviting.  Found the comfortable seats with no problem and ordered right away before the movie began.  I ordered pretzel sticks - food was hot, prompt & delicious.  I was excited for the movie to begin.  Once the advertisements were done and the movie started, that's when I noticed something wasn't right.  The entire screen was so dark that I was not able to make out the faces of the actors on the screen.  I kept lifting up the 3D glasses to see if it made a difference - nope.  The two people seated next to me were noticing the same and complaining.  I thought that maybe this is how the movie was filmed?  Then it got worse.  Even with the 3D glasses on, the shadows in the background on the screen were double and there was no discerning most actors' faces at all.  I got up and went to the lobby and asked for the manager.  The gentleman wore a blue shirt, middle age with a beard, said that this was the 3D experience, it was a ""closed-system"" and there was nothing he could do.  I simply asked him to come with me into the theater to see with his own eyes how dark it was.  He would not and did not.  I suspect this wasn't the first time he's heard this from a customer.  I've seen normal movies at this location before, but this was my first, and last experience with their 3D in room #1."
Kj7HMhdzGih7D7FCL13OOw,2uEiUCdT57UeaVkL8mjIqg,HcEOK1WiOpHvhZtp7PkRmg,1.0,"Overpriced for average food served warm (not hot) by servers who had trouble saying the names of the dishes and seemed in a rush to give us our bill when the place was more than half empty (on a Saturday night). When one of the servers came over to check on the $23 pork chop (which was not listed in the menu - $18 price was), my spouse commented there was a lot of fat....she seemed baffled by his comment, then walked away! The ""ropa vieja"" dish was good, but overpriced for being served in moderate portion. The menu prices did not reflect the ambiance (random plastic container boxes placed on a nearby table nor the sagging knitted item hanging over our table - it looks like there should've been a lamp in it)."
au9AZ-eeVBJ_3KcB05jCrg,c-1P_Hx6J-Dr8UzpRMwO3Q,WecgAHgzAPLOmM-6-Iga2A,2.0,"I'm rating this based on the service and not the food. I am a sales administrator at a hotel. Typically, many places offer a hospitality discount because we do refer guests different places. Front desk told me I should try this place as they give a decent discount. I called to place my order and wasn't really able to say what I liked b/c the girl who answered would cut me off to finish my statement.(she wasn't in the best mood) We get to the end of the order and she asks me am I a guest or an employee. I told her an employee. She asked my title. I told her. She gives me a total and I asked her about the discount. She says it's only for front desk. I'm shocked that this is a departmental thing 1 and 2 I'm thinking to myself, ""I'm in sales. I get groups of people here. They ALWAYS asked for recommendations."" I said well should I hang up and have front desk place my order? She huffed and puffed and then said ""well i'll give it to you this time but please dont abuse it."" I was so shocked at how rude she was. So when I finally got my food, I tipped the driver and gave him their menus back and said we will no longer be doing business with you guys. She didnt know SALES is in charge of who the front desk can recommend. Her name was Neisha.The food was good though."
MJjWo6VjPZbpwDrAy1Uf0w,uxSJNuWrpb1mNePNnHF_wA,NV6zZPb5OGVpyX4JrSzUPg,2.0,"We won't be back. We got the Brussel sprouts and they tasted like pure salt. Our server sent them back and we got another batch and they tasted exactly the same. My husband got the burger and it was okay but the fries that came with it tasted like pure salt also. Maybe the cook working this night was just a little heavy handed on the salt, I don't know. I got the flank steak and it was okay. I wouldn't rave about it or ever get it again. Our cocktails were good and the atmosphere was nice, but we were really disappointed with the food :("
48Mv4oT4Q8MdbFV0CXi3cQ,x7H8hr5q6XWUEw1zDWDKKg,SlGNxQI23jc9iTZNTs_I3g,2.0,"Tried this place out after many suggestions from friends.  We went in one night about an hour or so before closing just to find that they were only serving a partial menu - we're not talking that late, it was like, 9:30 on a weekend.  There was no mention of going down to a bar menu on the website so I was a bit annoyed by that.  Something about 'surprise disappointments that could be totally avoided' really bother me.  So, the dish I had picked out online wasn't available and I ordered a burger instead.  The server seemed to have a very hard time understanding my burger and suggested that modifications couldn't be made?  I told him I'm sure removing a single topping wouldn't cause the kitchen staff any issues...  The rest of the meal we were generally ignored and the service wasn't great.  I found the food to be overpriced for the quality.  Unless there is a special reason to attend, I don't think we'll be going back."
TunQqLbhPJDpncASCgkxmA,22MQF_kXWsFHvY76DaUKSQ,jtsckI_01hlbGLpEFwJu0A,2.0,"I first found out about this adorable little salon here on yelp while looking for a place to get a manicure downtown/ CBD.  I visited on 3/8/13 and got their ""Mini Manicure""- it's only $15!  I chose an OPI polish and the nail technician did a GREAT job!  So great in fact, that today on Monday, 3/18/13- I did not have ONE CHIP!  This is amazing for polish!  My nails looked fabulous!  The technician was friendly, as were the other stylists.  I'm not sure if it was the manager or the owner that was working the front desk- but she came over as well and was super friendly and welcoming.  The salon looks amazing, trendy, and peaceful.  It has a great vibe.  I was so happy with my first appointment- that I went back today, and left disappointed.  I went to the same nail techinician- and we talked as she worked on my nails.  The person working the front desk (seemed like an owner/ manager- although different from my first visit) was SO  nice, welcoming, and talkative.  This time though I needed a gel manicure, in french- as I am in a wedding this weekend.  I explained that I was in the wedding, assuming the technician would know that this more special than just an everyday manicure  The technician stated after she started my nails, that she did not have the proper brush that she needed in order to do the manicure.  So like most places- they paint the white, and then go back later with a brush to create the crisp, perfect line.  Since she did not have the brush to do that- she used a q- tip.  So obviously the lines are not perfect or even.  Along with the lines being uneven- some are thicker than others, and the edges go up, instead of down.  My nails are not at all filed and shaped pretty either.  For $40 (+ a tip)- I really expect them to look right.  I went during my lunch hour, and it was supposed to be 30 minute appointment, but the appointment took a little bit over an hour.  I understand that french takes a little extra time- but this seemed like quite a bit extra.  I was late for work, and had to hurry out of there when she was finished and did not want to be even more late to work to stay there to make a complaint.  I wish I would have- but I also felt bad because the technician was trying so hard- but they are just not up to par.  I'm conflicted, but I don't know that I'll return.  I loved it to so much the first time, I even sent friends over there.  But after this time- I am not happy with the product.  I wish it wasn't gel- because I can't even take the polish off myself.  So I'm forced to have nails that I am unhappy with, or go to somewhere else and pay to have this taken off, and then pay to have them re done- all before a 6am flight on Wednesday morning, and it's Monday afternoon...."
vO3U8-c5_vxRQ1hIrNeeOw,xd8dyISjf_tKU2oPxTIARg,k6XrnjX2TBM_nDzD_XA9NQ,2.0,"First off, it is a bar through and through. The alcohol selection is good and the drinks well mixed. It is also a casino bar, so you'll be paying higher than average prices. There is a small food menu, but the selection isn't that great. To add insult to injury the food made me ill. The reviews about service aren't exaggerations. We, too, practically had to tackle our server to order food and drinks many of times. Not my preferred place to go when there are so many better options in Reno."
2wKZZmCeM8mSbMGzdTfXrw,qCGEcUohmw5-1RV2WK2a5A,6xrDP4-S2mky3wOprv686A,1.0,"Quite possibly the perfect business model to fail if it wasn't for a sequestered clientel?  We visit New Orleans often, and it is an activity of ours to bet on how many beers or ingredients they are out of.  Bartenders rude and swearing. It's almost comical, we sit and listen to patrons asking for draft beers and mixed drinks and getting responses ""can't do that"".  They said ""No mules"", to at least 5 people as we sat for about 30 mins today.  2 out of 4 taps not working. What an absolute waste of opportunity."
VJxazz5W7xzOw-MylSeQCA,oQUyojSOb6rdMnusw0M5lg,-ATiAtTikuGuqvaW2O6tNA,1.0,"Really disappointed. I've been to the Marathon at 18/Spruce and had excellent service, drinks and food. Thought that would transfer to this location - not at all.  To sum it up, our server was extremely energetic, but not in a good way. More like a frantic energy. I was there to enjoy a few drinks and dinner with a friend who was visiting (AKA looking to spend money AKA you will get a larger tip if you let us stay longer) and we were rushed out. Server brought boxes for food we were still eating, without asking if we wanted them. A few minutes later he physically put the food in the boxes at the tableside while mumbling something like ""I don't like food sitting on the table."" .....we didn't even want to take it home. Next, when we said we were having another friend join for another round or two of drinks he told us we couldn't stay at the booth we were at and we needed to go to the bar. What? I point blank asked him if he was kicking us out of the booth and he said ""yes!"" energetically. There was no one waiting for tables and there were numerous open tables/booths around the restaurant. I felt extremely uncomfortable and wanted to leave immediately. Our friend joined after all this happened, and when the server came over to ask if they wanted a drink, he seemed surprised when we told him we were just going to leave. YOU LITERALLY just told us we couldn't sit at this table any longer!! We then left.  I worked in restaurants for a long time and I'm pretty easy to please when it comes to restaurant service. I was not pleased at all during this visit.  On another note, the food was not that great."
xhhmoxmvIJp16ozmxBuZZg,iiRTJ3x2Z4S3d5ZZ24vmdA,yE1raqkLX7OZsjmX3qKIKg,2.0,"We arrived for lunch at 12p on a Friday - wasn't busy at all. It took FOREVER to get anything. We were really pleasant and kind but we had to complain several times to get any beverages that we ordered. It took them 40 minutes to let us know that a beer we ordered was no longer available. The food was great, but not worth the lengthy wait and slow service."
Peh0HfcHatme02FWQTa8Zw,jVSDkxfr66ar4_HRArsT9Q,YgMZm_alGFUeQO4hz9X9VA,1.0,First time I went to Earl's new American kitchen I liked the food it was good wasn't great but it was a ok   service not so great sat at the bar did not really care for a bartender tried it again second time bartender was really rude I would never go back there  or Recommend it to anyone
81QT9uJgY_dQuD1sLF6psA,cbwA1FlBQbaF0P1UISFVOw,BIW1SKq5ItkA9gP6-FhSkA,1.0,"this place was awful. the first time my mother and I went we were very excited because everyone had been talking about it and we want to support local business. The day we went it happened to be pouring raining. So we are standing there at the hostess stand cold and wet waiting to be seated. Not only was the hostess not there, no one even acknowledged that we were there. The bartender who was right next to he stand was on his blue tooth and only looked our way to flirt with me. My mom was so annoyed we just left.   The second time we went was because we were going to be in the area and we decided to give it a second try. We were seated right away and the music was really good. The waiter could have cared less about our table. he acted like we were doing him a favor by even coming to the table. The menu was thin and nothing to really choose from. when he eventually brought the food it was decent. My mom hated her salmon cakes because they were overly breaded and poorly season. it honestly looked like two pieces of bread.   It was overpriced for what we had. I WOULD NEVER RECOMMEND THIS PLACE. The take out makes great dog food though."
kLgcYk9TxIjLe6y6eChetg,g7B4nU8SiXjir8NjCYY2Rg,SeAF6UA88vWbKFkZ7iQRhA,1.0,"Unfortunately, I'm NOT happy after coming to this salon yet again. I got a message from the owner saying he'd like to have me come in to receive a FREE service because they previously ruined my hair. So, I thought since he's the owner my hair would turn out good but I was wrong. I'm really unhappy with this whole experience. I showed him multiple photos on google of what I wanted done to my hair which was a lot of blonde. I told him I do not want any ORANGE in my hair as I wanted a ""white blonde"". He said you won't have any orange in your hair. I have a message from him the OWNER saying I would receive a FREE service if I deleted my previous review. He should of NEVER offered a free service if it wasn't really free! So, I said how much because I thought I was getting my hair done for free. He said since your hair is long and thick you'll have to pay for the hair color and ""medicine"" but he won't charge me for his time. I said ok how much he said $80. He said it would cost me $180 if he didn't give me a discount which is very pricey. He put a lot of highlights on my hair and worked quickly as he seemed to want to rush on my hair which I do not like. My hair is important to me, I don't want my hair to fall out. He said this medicine he's gonna put on my hair is $50 for a treatment and that I needed it because of the blonde going on my hair which I know any coloring is damaging and blonde is very damaging but he said he charges everyone who gets hair color for this so called medicine which they mix into the color you dye your hair. You can purchase the entire set online (3 bottles) for $75 which is supposed to give you like 15 applications so he's definitely charging a lot of money! He only put No.1 on my hair and not No.2 or No.3. He also had a lady (the receptionist) wash out my hair? Ok, even though she was nice why would he have her do that when she said she knows nothing about hair because I asked if she's styling my hair and she said she doesn't do hair and I wouldn't want her to do my hair. As I was waiting there was a lady next to me, she got her hair cut and a perm. She was done but she wasn't happy, she told the lady she didn't like the hair cut and she had her style it more and trim off a little more but the lady still wasn't happy. The girl told the client when she washes her hair it will be better.. um how? I know she left very unhappy! Also the lady behind me was getting her hair cut and when he (the owner) was done cutting her hair she looked in the mirror and wanted it different and styled different so that made me have to wait longer but 2 clients were not happy and also myself. That's not a good look TJ nail and spa! I had a towel on my head and waited about 30 mins just to get my hair blow dried because he was cutting another clients hair. I seen orange roots, I was mad!!! He finally came over and I said I don't like the orange color on my roots, can you put a toner on my hair and he said it's not orange it's the lighting. The lighting?! It wasn't the lighting! He proceeds to blow dry hair and then starts straighten it without asking me if I wanted it straightened or curled, you are supposed to pick how you want your hair styled. At that point I knew my hair wasn't what I wanted and it wasn't gonna be fixed even if I wanted it too. I just sat there in the hair, mad and yet again very disappointed! I looked in the mirror and seen my hair damaged and brittle, orange and brassy and not even close to what I wanted. There goes my money down the drain, yet again. I will not be back to get my hair ruined and he made me delete my previous review which was also 0-1 stars before I left his salon but I had to write this one, this is real, this is honest, beware of getting your hair completely ruined and nothing close to what you want! Like I said I showed the OWNER multiple photos and I stated I did NOT want any orange on my hair but I did have orange on my hair, I didn't get what I wanted like he said, he said he doesn't mess up, he's been doing hair for years. As a salon owner I think he should take the time to really do what the client wants and achieve what the client wants done to their hair, if the workersowner would do that then there shouldn't be any bad reviews but there is so that shows you they do not care, not even the owner cares. They just want to rush and get done to get paid, they don't care if the customer is happy or not. There are more bad reviews from people going to this salon and having horrible experiences but he is bribing people to delete their bad reviews because he told me the bad reviews is hurting his business which is why people do reviews, to let people know this place is awesome or this place is horrible, beware, stay away. I do reviews to let people know the good, the bad and the ugly. I do reviews anywhere and I'm always 100% honest. So, if bad reviews hurt his business that is all on him and his employees not me or anyone else."
dhAiK5f4zNBdG7cBTXJ0gg,KGXEzZqlm9TrO1bLpkgShw,zwfN21b6gN2XGjNG6MYNzQ,1.0,"First time at Wolfgang. Crowded, dirty floors, poor service, it has it all. Only redeeming factor was the excellent crisp Chardonnay."
